{
  "config_sha256": "24471b40eebf64badb9b4d99b52a41c0a82ee9f4b30be3aca63c399105f2fadd",
  "final_holdout_used": false,
  "gate_status": "review_pending",
  "inputs": [
    {
      "path": "configs/stage9_mathematics.yaml",
      "sha256": "6b73c4f2a82dc1cce93ef8b111f65b417c2f532e51973e268fbaf24ef13aa001",
      "size_bytes": 482
    },
    {
      "path": "registries/stage9_proof_review.yaml",
      "sha256": "a54d6b5af15fe83621f444282a21d480f352745dd7ae2e3ea55da7bb8cdacd8e",
      "size_bytes": 965
    },
    {
      "path": "reports/stage8/G8_ACCEPTANCE.json",
      "sha256": "4fe87527ba9e99681e7a6434e636a17363c224e9ad7badce02740844fb7acbfa",
      "size_bytes": 1502
    }
  ],
  "outputs": [
    {
      "path": "docs/science/STAGE9_THEOREMS_AND_PROOFS.md",
      "sha256": "45eaf3d7abe2faf2c0f7fe2b0bd6a702b2029b88f0b74eb83463b62ded2b274f",
      "size_bytes": 13730
    },
    {
      "path": "docs/protocols/STAGE9_MATHEMATICAL_AUDIT.md",
      "sha256": "ee7bc822b132d6904075a5c1150b7a44e5a04fbe0c810d4917be1402cca7a183",
      "size_bytes": 2370
    },
    {
      "path": "src/topoastero/mathematical_relations.py",
      "sha256": "8b17841383ef64d7fae99a357567a7a74c4210f735f76a7be3c3d6a3a368aff8",
      "size_bytes": 9098
    },
    {
      "path": "schemas/stage9_numerical_audit.schema.json",
      "sha256": "3d8348a40b1fef2800cbc812a745b76ac0677b7ec659e3eac71add1329b6cd90",
      "size_bytes": 2583
    },
    {
      "path": "results/stage9/numerical_audit.json",
      "sha256": "7144aaab4fac1ff74dea8825dcf1847d3de32a980459b78d966083edf2475184",
      "size_bytes": 1027
    },
    {
      "path": "results/stage9/environment.json",
      "sha256": "ca9bd95a28550788d782e53a83118d87e4da0dc93fbfe9410856a78b3289f46c",
      "size_bytes": 178
    },
    {
      "path": "tests/unit/test_mathematical_relations.py",
      "sha256": "49b0f9c38c84249abbc33b005c1083361800161e88b84605a569cd58fc3c27c5",
      "size_bytes": 6656
    },
    {
      "path": "workflows/run_stage9_mathematics.py",
      "sha256": "41cd7ef2ed8e10c4a5397723a3d96e18b8f7a8d2b31836502aaa36c36918acdc",
      "size_bytes": 12500
    },
    {
      "path": "notebooks/09_mathematical_relations.ipynb",
      "sha256": "aef07fe8ae5a50eb3fcf28fc3c75a333bcbe4a607006de1d9c73b649fc20d9f6",
      "size_bytes": 42720
    },
    {
      "path": "workflows/execute_stage9_notebook.py",
      "sha256": "73d844fa867d937c3ec8847b567c1b1c347d4ca37275c99485e09640adda2bdd",
      "size_bytes": 1969
    },
    {
      "path": "reports/stage9/figures/ridge_jump_bounds.svg",
      "sha256": "4380df5f767f825949a2eeb9549e77e8bc4997284ddc57d7e73aa507aea1469d",
      "size_bytes": 32295
    },
    {
      "path": "reports/stage9/figures/gamma_calibration.svg",
      "sha256": "42583581e4b99a98b492b033e16a40033231673a28f96cda3fc8da0599e4fbe4",
      "size_bytes": 48932
    },
    {
      "path": "results/stage9/counterexamples.json",
      "sha256": "9c01c9eeeca041f07e7a5cd901f6d8ebb1f461400ca94a61d2174b17d17d1155",
      "size_bytes": 2240
    },
    {
      "path": "reports/stage9/COUNTEREXAMPLE_CATALOG.md",
      "sha256": "4a15a9ac8f174dfe7a39890c97d5a8d0268c0cd5ea7affa1ac417f17511ccea0",
      "size_bytes": 2549
    },
    {
      "path": "schemas/stage9_counterexamples.schema.json",
      "sha256": "9c1ce52ca751bd202eb0f2e2f0aa0220207f439797e2e8b107eadf65d9a9d9c5",
      "size_bytes": 1167
    },
    {
      "path": "reports/stage9/UNCERTAINTY_PROPAGATION.md",
      "sha256": "487e9e386cb56dcdee1a709ee4e00d97982d51e042262ccb8b3e8dcd1e78c5da",
      "size_bytes": 2214
    },
    {
      "path": "reports/stage9/PROOF_REVIEW_PACKET.md",
      "sha256": "18241c26ff4b2371c66b36c72d5ec564d3ff3038f5cd50be055681861b7222ea",
      "size_bytes": 1855
    },
    {
      "path": "reports/stage9/G9_ACCEPTANCE.json",
      "sha256": "57014549f566db448513c6dbd242af6fef07dbed961ca52d0c137630739f8fa1",
      "size_bytes": 878
    },
    {
      "path": "reports/stage9/STAGE9_REPORT.md",
      "sha256": "5919b5019eea2ee2c10db82ec3775b833a74750b6f307a5af44a9c7eff3e5a20",
      "size_bytes": 1086
    },
    {
      "path": "reports/stage9/TRACEABILITY_MATRIX.md",
      "sha256": "a15e3ded6b5bb884c5871214379f9b85401c4c7f79b9a3b60d58fc47d0f7ce8c",
      "size_bytes": 1452
    },
    {
      "path": "schemas/stage9_gate.schema.json",
      "sha256": "2488c835082ad5afd5bc8da333ef5ac3a9fd6501c84bfe1777da0dd19f11113b",
      "size_bytes": 1293
    },
    {
      "path": "schemas/stage9_run_manifest.schema.json",
      "sha256": "45c478bfdfed73b7e4e07e87dc0ecf1fc895bc4d235b5ea55354e77b912f48b1",
      "size_bytes": 1227
    },
    {
      "path": "src/topoastero/stage9_validation.py",
      "sha256": "1c9a5f4128a32e70f391f670973f2ffa009a029b06ae746064dbbbeb8de0ec27",
      "size_bytes": 13072
    },
    {
      "path": "workflows/validate_stage9.py",
      "sha256": "6b10a3bdda488d084cce6dd1748a75a1196f7ad8a5569de466df7447337ab19b",
      "size_bytes": 822
    },
    {
      "path": "tests/governance/test_stage9_contract.py",
      "sha256": "30e899aecb2db3e6cc74857c53ae238172e8ca028b321e758791b85b863eb80e",
      "size_bytes": 5454
    },
    {
      "path": "tests/governance/test_stage9_schemas.py",
      "sha256": "88eefc5e72ff28fa168f3cce7a58501fa630544c38de1504ddb791bbd88a49d9",
      "size_bytes": 968
    },
    {
      "path": "tests/integration/test_stage9_cli.py",
      "sha256": "58a33f9f86ee6639a9ba05a43fc0242ada6f1fa02e7e25d4800995e3894d85f8",
      "size_bytes": 580
    },
    {
      "path": "README.md",
      "sha256": "db36373125feeae11414442b00e52be18cf8f7fcdf11d3dd746eb2b23e737b60",
      "size_bytes": 28113
    },
    {
      "path": "CHANGELOG.md",
      "sha256": "d4de643951c9234d7d3821d1b7cc0964bdba35f82bb01c739a62f687f233519e",
      "size_bytes": 11019
    },
    {
      "path": "CITATION.cff",
      "sha256": "654207bd435a22a470352b429ae4ff4e54f523ef1e756a111400cbd5301663eb",
      "size_bytes": 368
    },
    {
      "path": "pyproject.toml",
      "sha256": "efeada29a78841e65da2fac03d39e8fdb093702116d6d851bc3048c48d72e55b",
      "size_bytes": 2035
    },
    {
      "path": "uv.lock",
      "sha256": "8eb4be82be76ebb6d4d9856fc797d729ff4dcf42a1e00dde59d8e359765626a6",
      "size_bytes": 734011
    },
    {
      "path": "src/topoastero/__init__.py",
      "sha256": "84348631de60efa75f9ce958b5e46170b621d519ca6df36d12b0980f5210c215",
      "size_bytes": 172
    },
    {
      "path": "src/topoastero/cli.py",
      "sha256": "78f4869b6c6fdf17a33b66e9f016e85b81bb458ce919c2a5a9acfaf3b358a69b",
      "size_bytes": 11888
    },
    {
      "path": ".github/workflows/ci.yml",
      "sha256": "b53406e5a9415cabaf845692c1b3001d6c1cda78c0a0cb6c59ab4f4c6e6dfcc0",
      "size_bytes": 2975
    },
    {
      "path": "workflows/README.md",
      "sha256": "d2e4ce94bda5bf9a041157f1f1fbf744a1589a0b6c0aa763791fea494f3a67eb",
      "size_bytes": 5516
    },
    {
      "path": "workflows/build_stage9_manifest.py",
      "sha256": "a5a671af7a21cb2fd2a088a447f32471a11521829d5444bf85e8f39099c7a780",
      "size_bytes": 8057
    },
    {
      "path": "workflows/repair_portability.py",
      "sha256": "cc2ad2d487be4d5ab26a53e186bd9a64ebc229574be39f1c00a635af9a43fcf0",
      "size_bytes": 15648
    },
    {
      "path": "registries/decision_log.csv",
      "sha256": "7cda8213fbece4b661ca48d5b657414ae7db5240315b5daf6633c1efa824f634",
      "size_bytes": 6612
    },
    {
      "path": "registries/change_log.csv",
      "sha256": "3cb7c3b3ce81b8fcced09853474752ec298c370e58cf7ce45bca7dc8509a4c2f",
      "size_bytes": 5174
    },
    {
      "path": "registries/experiment_ledger.csv",
      "sha256": "4a8e50763f3e5e0d41865b66fd5ecc920e78f396bd5dc8d9016f4e11cd7b7a3f",
      "size_bytes": 6811
    }
  ],
  "population_spectra_used": false,
  "run_id": "TA-S09-MATH-R001",
  "software_version": "TopoAstero-0.10.0",
  "status": "implementation_complete",
  "style_id": "TA-PLOT-1.0"
}
